source,original,corrected
gorkana,"medeuronet, Medical Writer", Medical Writer
gorkana,"AltAssets, Financial Journalist", Financial Journalist
gorkana,"IQPC, Technology Editor", Technology Editor
gorkana,"Sunday Express, Deputy Political Editor", Deputy Political Editor
gorkana,"Gorkana, International Media Researcher - Hungarian / Slovak / Czech-speaking",Gorkanaungarian / Slovak / Czech-speaking
gorkana,"n365 group, Native Advertising Editor", Native Advertising Editor
gorkana,"Kitchens Bedrooms & Bathrooms, Features Editor", Features Editor
gorkana,"Environmental Finance, Journalist", Journalist
gorkana,"Reporter - Energy Policy / EPA, The Wall Street Journal - DC",Reporter
gorkana,"Bloomberg, Speed Desk Reporter (Amsterdam)", Speed Desk Reporter 
gorkana,"DC Thomson, Photo Editor", Photo Editor
gorkana,"The Huffington Post, Technology and Life Writer", Technology and Life Writer
gorkana,"Markets Editor - Two years journalism, energy and/or finance experience preferred, OPIS - MD / TX", energy and/or finance experience preferred / TX
gorkana,"The Sun, Features Writer", Features Writer
gorkana,"9fin, Capital Markets Associate / Financial Journalist", Capital Markets Associate / Financial Journalist
gorkana,"The Tribune, Managing Editor (Bahamas)", Managing Editor 
gorkana,"XpertHR, Pay and Reward Editor - Part Time (Sutton)", Pay and Reward Editor
gorkana,"Mirror Online, Assistant Celebrity & TV Editor", Assistant Celebrity & TV Editor
gorkana,"The Times, Senior Designer", Senior Designer
gorkana,"Professional Pensions, Journalist", Journalist
gorkana,"Social Housing, Layout Sub-Editor - Part Time", Layout Sub-Editor
gorkana,"Research Europe, Editor", Editor
gorkana,"Reporter, The Bond Buyer - VA",Reporter
gorkana,"Hubert Burda Media, Style Editor - Interiors Portfolio", Style Editor
gorkana,"LabourList, General Election Reporter", General Election Reporter
gorkana,"Women's Health, Editorial Assistant / Junior Writer", Editorial Assistant / Junior Writer
gorkana,"The Ecologist, Contributing Editor (Homeworking)", Contributing Editor 
gorkana,"MailOnline, Assistant Social Media Editor", Assistant Social Media Editor
gorkana,"Insurance Day, News Editor", News Editor
gorkana,"Tesco Magazine, Editor", Editor
gorkana,Content Lead (Medical Education),Content Lead 
gorkana,"​The Chartered Quality Institute, Content Executive", Content Executive
gorkana,"Atlas, Freelance Digital Content Editor", Freelance Digital Content Editor
gorkana,"The Sun, SEO Editor", SEO Editor
gorkana,"The Times, Tablet Editor", Tablet Editor
gorkana,"Last Word, Digital Designer", Digital Designer
gorkana,"SWNS, Video News Editor", Video News Editor
gorkana,"Which?, (Senior) Researcher / Writer", 
gorkana,"Community Inspired, Editorial Assistant", Editorial Assistant
gorkana,"The Wall Street Journal, Mobile Editor - Maternity Cover", Mobile Editor
gorkana,"Classic Car Buyer, Editor", Editor
gorkana,"PEI Media, Production Editor", Production Editor
gorkana,"Digital Health, News Reporter", News Reporter
gorkana,"Total 911, Features Writer", Features Writer
gorkana,"The Sunday Times, Digital Content Editor - Style", Digital Content Editor
gorkana,"Dow Jones, Assistant News Editor - Data Synergy (Barcelona)", Assistant News Editor
gorkana,Senior Reporter,Senior Reporter
gorkana,"Dow Jones, Wirtschaftsredakteur Unternehmen (Frankfurt am Main / Berlin)", Wirtschaftsredakteur Unternehmen 
gorkana,"InfraNews, Freelance Features Writer", Freelance Features Writer
gorkana,"Incisive Media, Special Projects Editor", Special Projects Editor
gorkana,Digital / Deputy Editor,Digital / Deputy Editor
gorkana,"Culture Trip, Freelance Copy Editor (Remote)", Freelance Copy Editor 
gorkana,"The Times, Graduate Designer", Graduate Designer
gorkana,"Immediate Media, Editor - Women’s Portfolio, New Launch", Editor
gorkana,"Capital Markets Reporter, Debtwire - NY",Capital Markets Reporter
gorkana,Content Editor,Content Editor
gorkana,"Social Media Director, WNYC - NY",Social Media Director
gorkana,"Architectural Digest Middle East, Editor-in-Chief", Editor-in-Chief
gorkana,Content Executive,Content Executive
gorkana,"Health Care Reporter, The Oklahoman - OK",Health Care Reporter
gorkana,"Meetings & Incentive Travel Magazine & www.meetpie.com, Reporter", Reporter
gorkana,"Mirror Online, Assistant News Editor", Assistant News Editor
gorkana,"Your Fitness Magazine, Editorial Assistant", Editorial Assistant
gorkana,"FinTech Global, Journalist", Journalist
gorkana,"Funds Europe, Senior Staff Writer / Assistant Editor", Senior Staff Writer / Assistant Editor
gorkana,"Hubert Burda Media, Editorial Assistant - Interiors Portfolio", Editorial Assistant
gorkana,"South China Morning Post, Editor - Audience Insights (Hong Kong)", Editor
gorkana,"Startup, Editor", Editor
gorkana,"MoneySavingExpert, Senior News Reporter", Senior News Reporter
gorkana,"LexisNexis, Senior Reporter / Writer", Senior Reporter / Writer
gorkana,"SWNS, Northern Editor", Northern Editor
gorkana,"GlobalCapital, Corporate Bond Editor", Corporate Bond Editor
gorkana,"Insight Editor – Content Strategist, Senior Editor", Senior Editor
gorkana,"Bloomberg, Finance Reporter (Zurich)", Finance Reporter 
gorkana,"Hearst Magazines, Digital Commercial Editor - Digital Content Studio", Digital Commercial Editor
gorkana,"Mining Journal, Senior Reporter", Senior Reporter
gorkana,"Ink, Creative Solutions Art Director", Creative Solutions Art Director
gorkana,"Writer / Editor - Member and Industry Communications, FIA - DC",Writer / Editor
gorkana,"Bloomberg, Digital Social Producer - EMEA, 1 Year Contract", 1 Year Contract
gorkana,"EQDerivatives, Head of Content - Asia Pacific (Hong Kong)", Head of Content
gorkana,"The Huffington Post, Editor-In-Chief", Editor-In-Chief
gorkana,"Deputy Editor / Senior Reporter, Absolute Return - NY", Absolute Return - NY
gorkana,"TBI, Deputy Editor", Deputy Editor
gorkana,"Property Week, Senior / Chief Reporter", Senior / Chief Reporter
gorkana,"Pharmaceutical Journal, Content Editor - People & Careers", Content Editor
gorkana,"MandateWire Europe, Reporter", Reporter
gorkana,"Digital Journalist, National Mortgage News - NY",Digital Journalist
gorkana,"Mirror Online, News Reporter", News Reporter
gorkana,"Criticaleye, Editor", Editor
gorkana,"Parent Zone, Junior Writer", Junior Writer
gorkana,"Editor - Audience Insights, South China Morning Post - Hong Kong",Editor
gorkana,"Shortlist Media, Copywriter - Family", Copywriter
gorkana,"ICIS, Markets Reporter (Sutton)", Markets Reporter 
gorkana,"Which?, Researcher / Writer - Money & Travel", Researcher / Writer
gorkana,"Foodism, Editorial Assistant", Editorial Assistant
gorkana,"Gas Strategies, Staff Writer - News & Features, Maternity Cover", Staff Writer
gorkana,"The Wall Street Journal / Dow Jones Newswires, Energy Reporter", Energy Reporter
gorkana,"OTC bulletin, Assistant Editor", Assistant Editor
gorkana,Senior Researcher - Hedge Fund,Senior Researcher
gorkana,"Computer Weekly, Reporter", Reporter
gorkana,"Culture Trip, Tech & Entrepreneurship Editor", Tech & Entrepreneurship Editor
gorkana,"Immediate Media, Art Editor - Women’s Portfolio, New Launch", Art Editor
gorkana,"HFM Global, Regulation Reporter", Regulation Reporter
gorkana,"Senior Reporter, Waters - NY",Senior Reporter
gorkana,"DailyMail.com, Motion Graphics Designer / Video Editor - Snapchat Discover", Motion Graphics Designer / Video Editor
gorkana,"MailOnline, Foreign Reporter", Foreign Reporter
gorkana,"Immediate Media, Digital Editor - Women’s Portfolio, New Launch", Digital Editor
gorkana,"Recruiter, The Wall Street Journal - NY",Recruiter
gorkana,"POLITICO, Financial Services Reporter", Financial Services Reporter
gorkana,"Prime Impact Events & Media, Managing Editor", Managing Editor
gorkana,"The Phnom Penh Post, Editor-in-Chief (Cambodia)", Editor-in-Chief 
gorkana,"AFP, Journalists (Paris / Hong Kong / Washington)", Journalists 
gorkana,"AFP, Denmark Correspondent - English-language (Copenhagen)", Denmark Correspondent
gorkana,"Mirror Online, Senior Reporter - Celebrity & TV", Senior Reporter
gorkana,"Aceville Publications, Content Writer - Special Projects Department", Content Writer
gorkana,"Global Blue Marketing Services, Online Managing Editor - Maternity Cover", Online Managing Editor
gorkana,"Estates Gazette, Senior Reporter / Reporter", Senior Reporter / Reporter
gorkana,"Night Editor - Digital Desk, The Wall Street Journal - NY",Night Editor
gorkana,"Incisive Media, Commercial Sub-Editor", Commercial Sub-Editor
gorkana,"Manufacturing / Industrial Reporter, Reuters (Level 1 Journalist) - IL / MI", Reuters 
gorkana,"Market Reporter - Metals, Argus Media - TX",Market Reporter
gorkana,"Dow Jones, Assistant News Editors (Barcelona)", Assistant News Editors 
gorkana,Financial News Commentary Journalist,Financial News Commentary Journalist
gorkana,"Presidential Daily Brief, Newsletter Contributor / Reporter (Remote)", Newsletter Contributor / Reporter 
gorkana,"hitched.co.uk, Editor", Editor
gorkana,"Grand Designs Magazine, Features Editor", Features Editor
gorkana,"Argus Media, Market Reporter", Market Reporter
gorkana,"Bloomberg, German Language Speed Reporter (Frankfurt)", German Language Speed Reporter 
gorkana,"Hearst, Picture Researcher (Job Share) - Weeklies", Picture Researcher 
gorkana,"Grow Your Own, Editorial Assistant", Editorial Assistant
gorkana,"Red, Art Editor", Art Editor
gorkana,"Archant Dialogue, Assistant Editor", Assistant Editor
gorkana,"Time Out GCC, Deputy Editor - Guides", Deputy Editor
gorkana,"M&A / Funds Reporter, InfraLatinAmerica - NY",M&A / Funds Reporter
gorkana,Data Journalist,Data Journalist
gorkana,"Digital Look, Junior Financial Journalist", Junior Financial Journalist
gorkana,"The Independent, Lifestyle Writer", Lifestyle Writer
gorkana,"The Register, Reporter", Reporter
gorkana,"Reuters, Finance Editor - Asia (Hong Kong)", Finance Editor
gorkana,"Egmont, Designer - Covermounts, 12 Month FTC", Designer
gorkana,"3D Artist, Editor", Editor
gorkana,"MoneySavingExpert, News Reporter", News Reporter
gorkana,"Dow Jones, Copy Editors (Barcelona)", Copy Editors 
gorkana,Temp News Reporter (Spa and Wellness B2B),Temp News Reporter 
gorkana,"HR Magazine, Deputy Editor", Deputy Editor
gorkana,"Vogue.co.uk, Vogue Daily Editor", Vogue Daily Editor
gorkana,Freelance Writer Covering Biopharmaceutical Sector in Latin America for Daily B2B News Service,Freelance Writer Covering Biopharmaceutical Sector in Latin America for Daily B2B News Service
gorkana,"Metia, Online Journalist - Contract", Online Journalist
gorkana,"The Times & The Sunday Times, Senior Producer - Multimedia", Senior Producer
gorkana,"Playbuzz, Designer", Designer
gorkana,Cyber Security Domain Expert,Cyber Security Domain Expert
gorkana,"Contributing Editor, Best Buy Drugs - Cost, Consumer Reports - DC", Best Buy Drugs
gorkana,"Legal Business, Reporter", Reporter
gorkana,"The Lawyer, News Reporter", News Reporter
gorkana,"SHOP Magazine, Artworker", Artworker
gorkana,"Unquote"", Reporter", Reporter
gorkana,"Energy Intelligence, Copy Editor", Copy Editor
gorkana,"Aceville Publications, Editorial Assistant - Special Projects Department", Editorial Assistant
gorkana,"olive, Sub-Editor", Sub-Editor
gorkana,"What's On Dubai, Digital Reporter", Digital Reporter
gorkana,"XpertHR, Employment Law Editor - Part Time (Sutton)", Employment Law Editor
gorkana,"The Independent and Evening Standard, Digital and Social Writer", Digital and Social Writer
gorkana,"The Sunday Times, Entertainment Editor - Style", Entertainment Editor
gorkana,"Lewis Buisness Media, Freelance Editor / Online Editor (Homeworking)", Freelance Editor / Online Editor 
gorkana,"Motivate, Editor - Global Client Publication", Editor
gorkana,"Times Higher Education, Sub-Editor - Part Time", Sub-Editor
gorkana,"Digital Enterprise Producer, The Oklahoman - OK",Digital Enterprise Producer
gorkana,"SPH Magazines, Editor - Creative Services (Singapore)", Editor
gorkana,"Women's Health, Fashion Assistant", Fashion Assistant
gorkana,"MailOnline, Freelance Moderators", Freelance Moderators
gorkana,"Dow Jones, News Writers (Barcelona)", News Writers 
gorkana,"Reporter - Washington Newsletter, The Wall Street Journal - DC",Reporter
gorkana,"Culture Trip, Commissioning Editor", Commissioning Editor
gorkana,"The Wall Street Journal, Audience Engagement Editor", Audience Engagement Editor
gorkana,"Which?, (Senior) Researcher / Writer - Telecoms", 
gorkana,"Immediate Media, Production Editor - Women’s Portfolio, New Launch", Production Editor
gorkana,"Women's Health, Features Editor", Features Editor
gorkana,"RN, Reporter", Reporter
gorkana,"b.inspired, Deputy Editor", Deputy Editor
gorkana,"Contributing Editor, Best Buy Drugs - Safety, Consumer Reports - DC", Best Buy Drugs
gorkana,"Future, Senior News Writer - Technology", Senior News Writer
gorkana,"Closer, Design Intern", Design Intern
gorkana,"Express.co.uk, Celebrity News Reporter", Celebrity News Reporter
gorkana,"New Internationalist, Production Editor", Production Editor
gorkana,"Metro.co.uk, News Reporter", News Reporter
gorkana,"MLex, News Editor (Brussels)", News Editor 
gorkana,Personal Finance Writer,Personal Finance Writer
gorkana,"Market Reporter, ICIS - TX",Market Reporter
gorkana,"New Scientist, Technology Editor (London or Boston)", Technology Editor 
gorkana,"The Times & The Sunday Times, Data Journalist", Data Journalist
gorkana,"Financial Planning Today, Staff Writer", Staff Writer
gorkana,"The Tablet, Home News Editor", Home News Editor
gorkana,"Senior Newsletter Editor, The Wall Street Journal - NY",Senior Newsletter Editor
gorkana,"Engerati.com, Technical Journalist", Technical Journalist
gorkana,"Exsus, Travel Copywriter - Intern to Permanent, 3 months", Travel Copywriter
gorkana,"Markets Editor, OPIS - MD",Markets Editor
gorkana,"Stylus, Content Manager - Maternity Cover", Content Manager
gorkana,"The Radar, Head of Content", Head of Content
gorkana,"ESI Media / The Independent, Senior Business Correspondent", Senior Business Correspondent
gorkana,"Law Business Research, Trainee News Reporter", Trainee News Reporter
gorkana,"YOU magazine, Designer", Designer
gorkana,"Pensions Expert, Reporter", Reporter
gorkana,"Ink, Production Controller", Production Controller
gorkana,"Emerging Media Visuals Producer, The Wall Street Journal - NY",Emerging Media Visuals Producer
gorkana,"thestack.com, Editorial Assistant", Editorial Assistant
gorkana,"Telegraph Media Group, Snapchat Editor", Snapchat Editor
gorkana,"Best, Celebrity Editor", Celebrity Editor
gorkana,"Press Association, Senior Sports Sub", Senior Sports Sub
gorkana,"Telegraph Media Group, Snapchat Senior Content Editor", Snapchat Senior Content Editor
gorkana,"Galaxy Publications, Editorial Assistant - Part Time", Editorial Assistant
gorkana,"French Chamber of Great Britain, Head of Publications and Content", Head of Publications and Content
gorkana,"Daily Mail, Features Executive", Features Executive
gorkana,"ELLE, Fashion Director", Fashion Director
gorkana,"Journal International Experience, Online Editor (Munich)", Online Editor 
gorkana,"Hairdressers Journal International, Editor", Editor
gorkana,"Central Banking Publications, Staff Writer (London or New York)", Staff Writer 
gorkana,"Telegraph Media Group, Economics Correspondent", Economics Correspondent
gorkana,"CE Media, Web Editor", Web Editor
gorkana,"Grand Designs Magazine, Deputy Editor", Deputy Editor
gorkana,"Hearst Digital Media, Project Manager / Script Writer", Project Manager / Script Writer
gorkana,"FMS Global Media, Project Manager", Project Manager
gorkana,"Essential Install, Trade Editor", Trade Editor
gorkana,"Money Observer, Web Content Manager / Writer", Web Content Manager / Writer
gorkana,"Staff Writer / Production Assistant, Stanford Magazine - CA",Staff Writer / Production Assistant
gorkana,"House & Garden, Online Features & Social Media Editor", Online Features & Social Media Editor
gorkana,"Tech Reporter, Communications Daily - DC",Tech Reporter
gorkana,"Longitude, Freelance Finance and Technology Specialist", Freelance Finance and Technology Specialist
gorkana,"Pharmaceutical Journal, Senior Subeditor - Maternity Cover", Senior Subeditor
gorkana,"portfolio institutional, Deputy Editor", Deputy Editor
gorkana,"Senior Reporter - Business and Economy, Southern California Public Radio / KPCC - CA", Southern California Public Radio / KPCC
gorkana,"Markets Reporter, Dow Jones - NY",Markets Reporter
gorkana,"NBC News, Picture Editor", Picture Editor
gorkana,"Assistant News Editor - Mobile, The Wall Street Journal - NY",Assistant News Editor
gorkana,"Ink, Digital Content Production Assistant - 6 Month Contract", Digital Content Production Assistant
gorkana,"Dennis Publishing, Content Strategist", Content Strategist
gorkana,News Editor,News Editor
gorkana,"POLITICO, Financial / Business Analyst  (Brussels)", Financial / Business Analyst  
gorkana,"Her World Plus, Editor (Singapore)", Editor 
gorkana,"Reporter - Private Equity / Restructuring, The Wall Street Journal - NY",Reporter
gorkana,"The Morning Advertiser, Reporter", Reporter
gorkana,"Top Santé, Editorial Assistant", Editorial Assistant
gorkana,"N-Photo, Editor", Editor
gorkana,"Mirror Online, Assistant Celebrity & TV Editor", Assistant Celebrity & TV Editor
gorkana,"Perfect Wedding, Deputy Art Editor - Maternity Cover", Deputy Art Editor
gorkana,"City A.M., Junior Designer", Junior Designer
gorkana,"Telegraph Media Group, Design & Interiors Editor", Design & Interiors Editor
gorkana,"MailOnline, Video Researcher - Freelancer", Video Researcher
gorkana,"Digital Financial Journalist, Investor's Business Daily - CA", Investor's Business Daily
gorkana,"William Reed, Digital Food Journalist - New Product Launch", Digital Food Journalist
gorkana,"News Reporter, CapitalStructure Americas Bureau - NY",News Reporter
gorkana,"Discover Britain, Deputy Editor", Deputy Editor
gorkana,"Official PlayStation Magazine, Staff Writer", Staff Writer
gorkana,"Hearst Digital Media, Video Editor", Video Editor
gorkana,"Mollie Makes, Editor - Maternity Cover", Editor
gorkana,"Business News Reporter, Mergermarket - CA",Business News Reporter
gorkana,"South China Morning Post, Experienced Copy Editors (Hong Kong)", Experienced Copy Editors 
gorkana,"Reporter - Venture Capital, WSJ Pro - CA",Reporter
gorkana,"Scotchwhisky.com, Deputy Editor", Deputy Editor
gorkana,"KYC360, Editor", Editor
gorkana,"Business Insider UK, Video Editing Fellow", Video Editing Fellow
gorkana,"Future, eCommerce Researcher & Curator", eCommerce Researcher & Curator
gorkana,"Finimize, Head of Content", Head of Content
gorkana,"Culture Trip, Junior Commissioning Editor", Junior Commissioning Editor
gorkana,"MailOnline, News Reporter", News Reporter
gorkana,"Creditflux, Reporter (London or New York)", Reporter 
gorkana,"3Fox, News and Digital Editor", News and Digital Editor
gorkana,"Morningstar, Sub-Editor", Sub-Editor
gorkana,Senior Reporter – Sub Investment – London,Senior Reporter – Sub Investment – London
gorkana,"Telegraph Media Group, Junior Features Writer", Junior Features Writer
gorkana,"Culture Trip, Freelance Writers - Chinese-Mandarin (Remote / Various Cities)", Freelance Writers
gorkana,"The Radar, eCommerce Editor", eCommerce Editor
gorkana,"Press Association, Features Writer", Features Writer
gorkana,"Scribol, Editorial Assistant - Full Time", Editorial Assistant
gorkana,"AltAssets, Trainee Financial Journalist", Trainee Financial Journalist
gorkana,"Ink, Creative Solutions Designer", Creative Solutions Designer
gorkana,"Telegraph Media Group, New Formats Producer - FTC",Telegraph Media GroupC
gorkana,"Speciality Drinks, Copywriter", Copywriter
gorkana,"Experienced Copy Editors, South China Morning Post - Hong Kong",Experienced Copy Editors
gorkana,"BizClik Media, B2B Editors", B2B Editors
gorkana,"Haymarket Automotive, Editor-in-Chief - Creative Solutions", Editor-in-Chief
gorkana,"Great British Chefs, Paid Editorial Internship", Paid Editorial Internship
gorkana,"Which?, Sub-Editor", Sub-Editor
gorkana,"Metro.co.uk, Search / SEO Reporter", Search / SEO Reporter
gorkana,"UBM, News Editor - Building", News Editor
gorkana,"Future, Media Services Operations Manager", Media Services Operations Manager
gorkana,"Zest Media, Magazine Editor", Magazine Editor
gorkana,"Stylist, Features Writer", Features Writer
gorkana,"The Marine Professional, Editor", Editor
gorkana,"Future, eCommerce Copywriter", eCommerce Copywriter
gorkana,"Hairdressers Journal International, Content Writer", Content Writer
gorkana,Deputy Editor,Deputy Editor
gorkana,"Reporter - Midwest, ​The Wall Street Journal - IL", ​The Wall Street Journal
gorkana,"Daily Mail, Personal Finance Correspondent", Personal Finance Correspondent
gorkana,"Mergermarket, M&A Nordics Correspondent - Maternity Cover (London)", M&A Nordics Correspondent
gorkana,"World Traveller Magazine, Content Editor (Dubai)", Content Editor 
gorkana,"Telegraph Media Group, Snapchat Content Editor", Snapchat Content Editor
gorkana,"Reporter, Debtwire Middle Market - NY",Reporter
gorkana,"Dewberry Redpoint, Junior Reporter", Junior Reporter
gorkana,"Professional Engineering, News & Social Media Editor", News & Social Media Editor
gorkana,Senior Medical Writer,Senior Medical Writer
gorkana,"Reporter - International Terrorism and Extremist Movements, The Wall Street Journal - DC",Reporter
gorkana,"POLITICO, European Politics and Finance Correspondent (London / EU Capitals)", European Politics and Finance Correspondent 
gorkana,"Red, Creative Director", Creative Director
gorkana,"ADE, Journalist and Content Editor (Brussels)", Journalist and Content Editor 
gorkana,"Future, Acquisitions Marketing Administrator", Acquisitions Marketing Administrator
gorkana,"Group SJR, Junior Digital Editor / Creative", Junior Digital Editor / Creative
gorkana,"Hairdressers Journal International, Online & Social Editor", Online & Social Editor
gorkana,"Your Fitness, Editorial Assistant", Editorial Assistant
gorkana,"Drapers, Art Editor", Art Editor
gorkana,"ITP Business, B2B Editorial", B2B Editorial
gorkana,"Reporter, Mansion - NY",Reporter
gorkana,"CNN.com International, Intern - Digital Features / Global Projects", Intern
gorkana,"M&A Reporter, Mergermarket - NY",M&A Reporter
gorkana,"Scotchwhisky.com, Editorial Assistant", Editorial Assistant
gorkana,"Reporter - US Stock Market, The Wall Street Journal - NY",Reporter
gorkana,"POLITICO, Tech Reporter (London / Brussels / Berlin)", Tech Reporter 
gorkana,"RWMG, Editor", Editor
gorkana,"MailOnline, Femail Writer", Femail Writer
gorkana,"Nursing Times, Online Editor", Online Editor
gorkana,"Villa 88, Editor", Editor
gorkana,"Legal Week, Reporter", Reporter
gorkana,"The Sun, Digital Reporters / Story Builders - Night Team", Digital Reporters / Story Builders
gorkana,"Your Home, Editorial Assistant", Editorial Assistant
gorkana,"Future, Acquisitions Marketing Executive", Acquisitions Marketing Executive
gorkana,"The Sun, Consumer Affairs Journalist - Digital", Consumer Affairs Journalist
gorkana,"Cruise Trade News & Cruise Destinations, Deputy Editor", Deputy Editor
gorkana,"ESI Media, Syndication Sales Executive", Syndication Sales Executive
gorkana,"Culture Trip, UK Books Editor", UK Books Editor
gorkana,"Government Computing, Reporter", Reporter
gorkana,"MoneySavingExpert, Consumer Writer", Consumer Writer
gorkana,"Blexr, Freelance Financial Writers", Freelance Financial Writers
gorkana,"BMJ Publishing, Publishing Executive", Publishing Executive
gorkana,"TheStreet, Reporter (London)", Reporter 
gorkana,"The Market Mogul, Editorial Associate", Editorial Associate
gorkana,"ING, Multi-media TV Producer & Editing Journalist", Multi-media TV Producer & Editing Journalist
gorkana,"Deputy Director - Tech Ops Video, The Wall Street Journal - NY",Deputy Director
gorkana,"Culture Trip, Freelance Writers (London-based)", Freelance Writers 
gorkana,"UKi Media & Events, Deputy Editor", Deputy Editor
gorkana,"Blexr, Head of Content (Malta)", Head of Content 
gorkana,"Travel Security Services, Editor", Editor
gorkana,"Feedinfo, Asia Editor (Asia)", Asia Editor 
gorkana,"ASDA Good Living, Fashion Assistant", Fashion Assistant
gorkana,"Global Investor Group, Editor", Editor
gorkana,"NBC News, Freelance Desk Video Producer - International News Desk", Freelance Desk Video Producer
gorkana,"TRBusiness Magazine, B2B Reporter / Writer - Business & Brands", B2B Reporter / Writer
gorkana,"Xbox: The Official Magazine, Staff Writer", Staff Writer
gorkana,"Dow Jones, German News Writer (Barcelona)", German News Writer 
gorkana,"Reporter, Reorg Research - NY",Reporter
gorkana,"airberlin, German Editor-in-Chief", German Editor-in-Chief
gorkana,"Freelance Infrastrucure Reporter - Canada, InfraAmericas - Toronto", InfraAmericas
gorkana,Account Director/Associate - FPR - London,Account Director/Associate
gorkana,"Good Housekeeping / Prima, Picture Researcher", Picture Researcher
gorkana,"Euronews, Head of Thematic Vertical Platform Travel (London or Lyon)", Head of Thematic Vertical Platform Travel 
gorkana,"FMS Global Media, Staff Writer / Sub-Editor", Staff Writer / Sub-Editor
gorkana,"Good Housekeeping, Creative Director", Creative Director
gorkana,"ESI Media / London Evening Standard, Retail Correspondent", Retail Correspondent
gorkana,"The Sun, Sub-Editor - Fabulous", Sub-Editor
gorkana,"Harper’s Bazaar Arabia, Digital Editor - Arabic Language", Digital Editor
gorkana,"Future, Topical Content & Events Editor", Topical Content & Events Editor
