source,original,corrected
gorkana,"PSNEurope, Staff Writer", Staff Writer
gorkana,"SevenC3, Deputy Chief Sub-Editor", Deputy Chief Sub-Editor
gorkana,"Reporter - CMO Today, The Wall Street Journal - NY",Reporter
gorkana,"SWNS, Features Writer", Features Writer
gorkana,"*Research (including Research Fortnight), Editor", Editor
gorkana,"Hearst, Digital Designer - Ad Studio", Digital Designer
gorkana,"BMI Publishing, Editorial Assistant", Editorial Assistant
gorkana,"The Sunday Times, Deputy Picture Editor - Style", Deputy Picture Editor
gorkana,"Mirror Online, Senior Reporter - Celebrity & TV", Senior Reporter
gorkana,"Reporter, American Metal Market - NY",Reporter
gorkana,"The Sun, Business Editor", Business Editor
gorkana,"Telegraph Media Group, Editorial Manager - Magazines & Lifestyle, Fixed Term Contract", Editorial Manager
gorkana,"SWNS, Junior Designer", Junior Designer
gorkana,"AV Technology Europe, Editor", Editor
gorkana,"Evening Standard, Freelance Web Assistant / Production Journalist - HomesAndProperty.co.uk", Freelance Web Assistant / Production Journalist
gorkana,"The Independent and Evening Standard, Commercial Special Projects Editor", Commercial Special Projects Editor
gorkana,"Business Reporter, Investor's Business Daily - CA", Investor's Business Daily
gorkana,"Pharmaceutical Journal, Reporter - Health Policy",Pharmaceutical Journalealth Policy
gorkana,"SSVC, Assistant Director / Producer", Assistant Director / Producer
gorkana,Editor of Research Europe,Editor of Research Europe
gorkana,"Telegraph Media Group, Head of Trending Content", Head of Trending Content
gorkana,"Energy Intelligence, Copy & Web Editor", Copy & Web Editor
gorkana,"Shortlist Media, Head of Content - Family", Head of Content
gorkana,"AFP, Journaliste Francophone (Stockholm)", Journaliste Francophone 
gorkana,Customer Research Analyst - Marketing,Customer Research Analyst
gorkana,Inbound Sales Executive,Inbound Sales Executive
gorkana,"Health and Fitness Magazine, Editor", Editor
gorkana,"Farmers Guardian, Freelance Sub-Editor", Freelance Sub-Editor
gorkana,"The Third Pole, Assistant Editor - Maternity Cover", Assistant Editor
gorkana,"Imperial War Museums, Digital Producer", Digital Producer
gorkana,"MailOnline, Sub-Editor - Snapchat Discover", Sub-Editor
gorkana,"Nursing Times, Production Editor", Production Editor
gorkana,"The Sunday Times, Fashion Director - Style", Fashion Director
gorkana,"Mollie Makes, Digital Editor - Maternity Cover", Digital Editor
gorkana,"Telegraph Media Group, Brexit Correspondent", Brexit Correspondent
gorkana,"Argus Media, Market Reporter - German-Speaking", Market Reporter
gorkana,"The Tablet, Home News Editor", Home News Editor
gorkana,"Pharmaceutical Journal, Senior Subeditor - Maternity Cover", Senior Subeditor
gorkana,"CRN, Deputy Editor", Deputy Editor
gorkana,"Entertainment News, Broadcast Journalist / Editor", Broadcast Journalist / Editor
gorkana,"Telegraph Media Group, Brexit Commissioning Editor", Brexit Commissioning Editor
gorkana,"Travel Security Services, Editor", Editor
gorkana,"Deputy Editor, Waters Magazine & WatersTechnology - NY", Waters Magazine & WatersTechnology
gorkana,"Nursing Times, Digital Engagement Editor", Digital Engagement Editor
gorkana,"Multimedia, The Times and The Sunday Times", The Times and The Sunday Times
gorkana,"Graduate designer, The Times", The Times
gorkana,Senior Staff Writer,Senior Staff Writer
gorkana,"Left Foot Forward, Staff Writer", Staff Writer
gorkana,"Tablet editor, The Times", The Times
gorkana,Android Developer,Android Developer
gorkana,"Egmont, Art Editor - We Love Pop", Art Editor
gorkana,"RCNi, Marketing Executive", Marketing Executive
gorkana,"Science TV Professor of Practice, The Walter Cronkite School of Journalism & Mass Communication - AZ", The Walter Cronkite School of Journalism & Mass Communication
gorkana,Senior Copy Editor,Senior Copy Editor
gorkana,"Faculty - Sports Production, The Walter Cronkite School of Journalism & Mass Communication - AZ", The Walter Cronkite School of Journalism & Mass Communication
gorkana,"Telegraph Media Group, Brexit Editor", Brexit Editor
gorkana,Regulation reporter,Regulation reporter
gorkana,"Reporter, FundFire - NY",Reporter
gorkana,"Construction News, News Editor", News Editor
gorkana,"SSVC, Digital & TV News Producers", Digital & TV News Producers
gorkana,"Metro, Commercial Editor", Commercial Editor
gorkana,"NCTJ, Communications and Digital Marketing Executive", Communications and Digital Marketing Executive
gorkana,"Grazia, Fashion News & Features Editor", Fashion News & Features Editor
gorkana,"Senior designer, The Times", The Times
gorkana,"FN NOW, Writer", Writer
gorkana,"Redwood, Deputy Art Director - M&S Account", Deputy Art Director
gorkana,"Markets Editor, OPIS - MD / TX",Markets Editor / TX
gorkana,"The Times, Art Director - Features", Art Director
gorkana,"Stylist Live, Events Designer", Events Designer
gorkana,"Travel Trade Gazette, Special Projects Editor", Special Projects Editor
gorkana,"ELLE, Acting Commissioning Editor", Acting Commissioning Editor
gorkana,"National Trust, Podcast Producer", Podcast Producer
gorkana,"Telegraph Media Group, Travel Assistant Content Editor Destinations", Travel Assistant Content Editor Destinations
gorkana,"Oh Comely, Editor", Editor
gorkana,"Times Higher Education, Reporter", Reporter
gorkana,"Stella Magazine, Deputy Art Director", Deputy Art Director
gorkana,"Telegraph Media Group, Travel Social Media Content Editor", Travel Social Media Content Editor
gorkana,"Evening Standard, Online TV & Ents Journalist", Online TV & Ents Journalist
gorkana,"D&AD, Editorial Executive", Editorial Executive
gorkana,"You & Your Wedding, Sub-Editor - Maternity Cover", Sub-Editor
gorkana,"​The Chartered Quality Institute, Content Executive - Maternity Cover", Content Executive
gorkana,"Schools Week and FE Week, Reporter", Reporter
gorkana,"Emerald Street, Writer", Writer
gorkana,"Travel Weekly, Junior Reporter", Junior Reporter
gorkana,"economia, Intern", Intern
gorkana,"Telegraph Media Group, Picture Researcher", Picture Researcher
gorkana,"Reporter, The Wall Street Journal - NY",Reporter
gorkana,"Homes & Antiques, Deputy Art Editor - Maternity Cover", Deputy Art Editor
gorkana,"Who Do You Think You Are? Magazine, Production Editor", Production Editor
gorkana,"Full Fact, Editor", Editor
gorkana,"economia, Online Sub-Editor", Online Sub-Editor
gorkana,"The Debrief & Grazia, Social Media Editor", Social Media Editor
gorkana,"Homepage Editor / Weekend Editor, NBC News Digital", NBC News Digital
gorkana,"Global Witness, Deputy Director of Communications", Deputy Director of Communications
gorkana,"The Mail on Sunday, Journalist - Financial Mail", Journalist
gorkana,"Attitude magazine, Freelance Sub-Editor", Freelance Sub-Editor
gorkana,"Morningstar.co.uk, Reporter", Reporter
gorkana,"New Internationalist, Magazine Co-Editor", Magazine Co-Editor
gorkana,"Ink Studio, Video Editor", Video Editor
gorkana,"Music Week, News Editor", News Editor
gorkana,"The Mail on Sunday, Deputy Editor - Health",The Mail on Sundayealth
gorkana,"West Coast Correspondent, The Independent - CA",West Coast Correspondent
gorkana,"The Independent and Evening Standard, Digital and Social Writer", Digital and Social Writer
gorkana,"HistoryExtra.com, Website Assistant", Website Assistant
gorkana,"IFLScience, Editorial Assistant - Copy Editor", Editorial Assistant
gorkana,"Top Gear Magazine, Editorial Assistant & Team Assistant", Editorial Assistant & Team Assistant
gorkana,"IFLScience, Editorial Assistant", Editorial Assistant
gorkana,"Press Association, Video Production Assistant", Video Production Assistant
gorkana,Digital Content Manager,Digital Content Manager
gorkana,"Telegraph Media Group, Senior Business Reporter - FTC",Telegraph Media GroupC
gorkana,"The Wall Street Journal / Dow Jones Newswires, Copy Editors", Copy Editors
gorkana,"Trade Press, Deputy Editor", Deputy Editor
gorkana,"CNN.com International, Intern - Digital Features / Global Projects", Intern
gorkana,"Market Talk, Reporter", Reporter
gorkana,"Stylist.co.uk, Editor", Editor
gorkana,"Telegraph Media Group, Senior Fashion News and Features Editor - Maternity Cover", Senior Fashion News and Features Editor
gorkana,"Shortlist, Sub-Editor", Sub-Editor
gorkana,"Times Higher Education, Production Manager", Production Manager
gorkana,"Kitchens Bedrooms & Bathrooms, Features Editor", Features Editor
gorkana,"Director and Professor of Practice, Cronkite News Digital Desk - AZ",Director and Professor of Practice
gorkana,Associate Editor,Associate Editor
gorkana,"The Drinks Business, Staff Writer", Staff Writer
gorkana,"The Sun, Digital Production Editor", Digital Production Editor
gorkana,"Boots Health & Beauty / Parenting Club, Features Writer - 12 month Contract", Features Writer
gorkana,"The National, Arts and Lifestyle Writer (Abu Dhabi)", Arts and Lifestyle Writer 
gorkana,"The Yorkshire Post, Political Editor", Political Editor
gorkana,"Formative Content, Sub-Editor", Sub-Editor
gorkana,"Reporter, The Bond Buyer - Remote / CA", The Bond Buyer
gorkana,"The Sun, Snapchat Production Editor", Snapchat Production Editor
gorkana,"Visiting Ferris Professor of Journalism / McGraw Professor of Writing, Princeton University - NJ",Visiting Ferris Professor of Journalism / McGraw Professor of Writing
gorkana,"Politics Editor, Newsweek - NY / DC",Politics Editor / DC
gorkana,"Telegraph Media Group, Assistant Foreign News Editor", Assistant Foreign News Editor
gorkana,"News Editor / Fashion Director - Off Duty, The Wall Street Journal - NY",News Editor / Fashion Director
gorkana,"Boat International Media, Deputy Picture Editor", Deputy Picture Editor
gorkana,"The Grocer, Food Trends Editor", Food Trends Editor
gorkana,"Clean Energy Pipeline, News Reporter", News Reporter
gorkana,"Deadline Journalist, RIABiz - CA / Remote",Deadline Journalist / Remote
gorkana,"Radio Times, Commissioning Editor - Drama", Commissioning Editor
gorkana,"Pharmaceutical Journal, Opinion Editor", Opinion Editor
gorkana,"MoneySavingExpert.com, Social Community Executive", Social Community Executive
gorkana,"The Grocer, Features Writer / Senior Features Writer", Features Writer / Senior Features Writer
gorkana,"Reporter, National Security/Foreign Policy", National Security/Foreign Policy
gorkana,"International Business Times, Online Features Writer", Online Features Writer
gorkana,"Presidential Daily Brief, Newsletter Contributor / Reporter (Remote)", Newsletter Contributor / Reporter 
gorkana,"Editor - Newsroom Standards, The Wall Street Journal / Dow Jones Newswires - NY", The Wall Street Journal / Dow Jones Newswires
gorkana,"The National, Technology Reporter (Abu Dhabi)", Technology Reporter 
gorkana,"Health Service Journal, Content Editor", Content Editor
gorkana,"China Daily UK, Copy Editor / Journalist", Copy Editor / Journalist
gorkana,"EBRD, Digital Editorial Assistant / Coordinator - Temp", Digital Editorial Assistant / Coordinator
gorkana,"Heating Ventilating & Plumbing, Editor", Editor
gorkana,"Chicago Health Care Reporter, POLITICO Pro - IL",Chicago Health Care Reporter
gorkana,"The Sunday Times, Freelance Digital Production Journalists", Freelance Digital Production Journalists
gorkana,"Food Spark, Digital Editor - 12 month Maternity Cover", Digital Editor
gorkana,"The Sun, Digital Showbiz Reporters - Casual", Digital Showbiz Reporters
gorkana,"International Business Times, Sports Reporter", Sports Reporter
gorkana,"Money Marketing, Head of News", Head of News
gorkana,"Executive Editor, Entertainment Daily - NY",Executive Editor
gorkana,"Editor, Live Journalism & Special Content", Live Journalism & Special Content
gorkana,Senior Analyst,Senior Analyst
gorkana,"The National, Arts and Culture Editor (Abu Dhabi)", Arts and Culture Editor 
gorkana,"The Grocer, Food & Drink Reporter", Food & Drink Reporter
gorkana,"Time Out, Junior Designer - EMEA",Time OutEA
gorkana,Features Editor,Features Editor
gorkana,"ES Magazine, Art Director", Art Director
gorkana,"Pharmaceutical Journal, Health Policy Reporter", Health Policy Reporter
gorkana,"Metro.co.uk, Video Researcher", Video Researcher
gorkana,"The National, Food Writer (Abu Dhabi)", Food Writer 
gorkana,"The World of Cross Stitching, Production Editor", Production Editor
gorkana,"Digital Producer, WSJ. Magazine - NY", WSJ. Magazine
gorkana,"Travel Weekly, News Reporter", News Reporter
gorkana,"SheerLuxe, Product Editor - Maternity Cover to Permanent", Product Editor
gorkana,"BikeRadar, Editor-in-Chief", Editor-in-Chief
gorkana,"Legal Business, Comment / News Editor", Comment / News Editor
gorkana,Research Writer & Commissioning Editor,Research Writer & Commissioning Editor
gorkana,"Express.co.uk, Health Reporter", Health Reporter
gorkana,"Legal Business, Senior Reporter / Reporter", Senior Reporter / Reporter
gorkana,"BT.com, Consumer Technology Writer - 6 Month Contract", Consumer Technology Writer
gorkana,"Reveal, Celebrity Intern", Celebrity Intern
gorkana,"Which?, Digital Writer", Digital Writer
gorkana,"BBC Music Magazine, Editorial Assistant", Editorial Assistant
gorkana,"Build It, Assistant Editor", Assistant Editor
gorkana,"Hearst Magazines, Creative Intern - Homes",Hearst Magazinesmes
gorkana,"Marks & Spencer, Womenswear & Lingerie Editor", Womenswear & Lingerie Editor
gorkana,"Hearst Magazines, Junior Designer - Homes",Hearst Magazinesmes
gorkana,"Heat, News & Features Writer", News & Features Writer
gorkana,"The Simple Things, Art Editor", Art Editor
gorkana,"LoveExploring.com, Editor", Editor
gorkana,"Time Out Dubai, Deputy Digital Editor", Deputy Digital Editor
gorkana,"ES Magazine, Art Editor - Maternity Cover", Art Editor
gorkana,"ES Magazine, Art Director", Art Director
gorkana,"Which?, Commissioning Editor - Property", Commissioning Editor - Property
gorkana,"Telegraph Media Group, Digital Production Editor", Digital Production Editor
gorkana,"Reporter, Credit Union Journal - NY",Reporter
gorkana,"Kitchens Bedrooms & Bathrooms, Editorial Assistant", Editorial Assistant
gorkana,"Spear's, Head of Editorial Research", Head of Editorial Research
gorkana,"YOU Magazine, Fashion Intern", Fashion Intern
gorkana,"Lovefood.com, Editor", Editor
gorkana,"Docket Journalist, CapitalStructure Americas Bureau - NY",Docket Journalist
gorkana,"Volkswagen, Writers - Temporary", Writers
gorkana,"Scribol, Editorial Assistant - Full Time", Editorial Assistant
gorkana,"Telegraph Media Group, Homepage Producer", Homepage Producer
gorkana,"Bloomberg News, Luxury Goods / Fashion Reporter (Paris)", Luxury Goods / Fashion Reporter 
gorkana,"Country Living and House Beautiful, Art Intern", Art Intern
gorkana,"The Sun, SEO Editor", SEO Editor
gorkana,Publishing Manager / Publisher,Publishing Manager / Publisher
gorkana,"Real Estate Capital, Reporter", Reporter
gorkana,"BBC Match of the Day Magazine, Editorial Assistant", Editorial Assistant
gorkana,"The Jewish Chronicle, Reporter", Reporter
gorkana,Head of Marketing - Luxury Hospitality Brand,Head of Marketing
gorkana,"woman&home, Features Intern", Features Intern
gorkana,"Military History Monthly, Assistant Editor", Assistant Editor
gorkana,"BikeRadar, Deputy Editor", Deputy Editor
gorkana,"The Sun, Sport SEO Editor", Sport SEO Editor
gorkana,"Barcroft Media, Content Licensing Executive", Content Licensing Executive
gorkana,"Heat,  Editorial Assistant",  Editorial Assistant
gorkana,"S&P Global Market Intelligence, Healthcare Reporter", Healthcare Reporter
gorkana,"ELLE Decoration, Decorating Editor", Decorating Editor
gorkana,"Mr & Mrs Smith, Editorial Assistant", Editorial Assistant
gorkana,"Hotelier Express, Editor", Editor
gorkana,"Livesquawk, Junior Market Reporter / Broadcaster", Junior Market Reporter / Broadcaster
gorkana,"News Reporter, CapitalStructure Americas Bureau - NY",News Reporter
gorkana,"News Sub-Editors, South China Morning Post - Hong Kong",News Sub-Editors
gorkana,"SHARES, Financial Journalist", Financial Journalist
gorkana,"Reporter, Law360 - Los Angeles, CA", Law360
gorkana,"Construction Week, Reporter", Reporter
gorkana,"Copy Editor, CapitalStructure Americas Bureau - NY",Copy Editor
gorkana,"FC Business Intelligence, Editor - Oil & Petrochemicals", Editor
gorkana,"i, Graphics Editor", Graphics Editor
gorkana,"GamblingCompliance, European Markets Reporter", European Markets Reporter
gorkana,"Fast Track, Business Writer & Research Analyst", Business Writer & Research Analyst
gorkana,"People Management, News Editor", News Editor
gorkana,"Airgun Shooter, Editor-in-Chief", Editor-in-Chief
gorkana,"The Sunday Times​, Features Sub-Editor", Features Sub-Editor
gorkana,"Business Reporter, Online and Community Editor", Online and Community Editor
gorkana,"Telegraph Media Group, Business Night Reporter", Business Night Reporter
gorkana,"Family Traveller, Digital Content / Social Media Coordinator", Digital Content / Social Media Coordinator
gorkana,"Engagement Editor, Honeyguide Media - NY",Engagement Editor
gorkana,"XpertHR Group, Production Editor - Maternity Cover (Sutton)", Production Editor
gorkana,"Peer-to-Peer Finance News, Chief Reporter", Chief Reporter
gorkana,"Construction News, Digital Product Manager", Digital Product Manager
gorkana,"Digital Spy, Picture Assistant", Picture Assistant
gorkana,"The Big Issue, Junior Designer", Junior Designer
gorkana,"Grazia, Picture Director - 12 Month Contract", Picture Director
gorkana,"You & Your Wedding, Chief Sub-Editor - Maternity Cover", Chief Sub-Editor
gorkana,"Immediate Media, Advertising Designer - Entry Level Position", Advertising Designer
gorkana,"The Big Issue, Junior Sub-Editor / Writer", Junior Sub-Editor / Writer
gorkana,"ITV, Assistant Producer - Loose Women, Maternity Cover", Assistant Producer
gorkana,"Telegraph Media Group, Assistant Planning Editor", Assistant Planning Editor
gorkana,"The Big Issue, Art Director", Art Director
gorkana,"The Wall Street Journal, News Assistant (Turkey)", News Assistant 
gorkana,"olive, Chief Sub / Production Editor", Chief Sub / Production Editor
gorkana,"SWNS, Deputy Features Editor / Senior Features Writer", Deputy Features Editor / Senior Features Writer
gorkana,"Press Association, Senior Production Editors", Senior Production Editors
gorkana,"SFX & T3, Production Editor", Production Editor
gorkana,"Aceville Publications, Regulars Editor - Crafts Beautiful / Make It Today", Regulars Editor
gorkana,"Ink, Digital Editorial Consultant", Digital Editorial Consultant
gorkana,Careers Editor,Careers Editor
gorkana,Financial Journalist (contract),Financial Journalist 
gorkana,Editor- 3D Artist,Editor- 3D Artist
gorkana,"Simply Sewing, Editor - Maternity Cover", Editor
gorkana,"UBM, Building and Building Design, freelance journalists", Building and Building Design
gorkana,"UBM, Building, News Editor", Building
gorkana,"Reporter, NFL", NFL
gorkana,"UBM, Building and Building Design, sub-editors", Building and Building Design
gorkana,Sport Social Media Editor,Sport Social Media Editor
gorkana,"PRI, Content Editor", Content Editor
gorkana,"Reporter, CMO Today", CMO Today
gorkana,"CONTENT DEVELOPER | Digital, Tech", Tech
gorkana,Look Magazine - Acting Fashion News Editor (Maternity Cover),Look Magazine
gorkana,"Square Up Media, Editorial Internship", Editorial Internship
gorkana,"RCNi Learning &  Nursing Standard, Senior Nurse Editor", Senior Nurse Editor
gorkana,Communications Co-ordinator,Communications Co-ordinator
gorkana,"Sport360, Sub-Editor / Reporter", Sub-Editor / Reporter
gorkana,"Telegraph Media Group, Assistant News Editor", Assistant News Editor
gorkana,"IFLScience, Video Content Writer / Editor", Video Content Writer / Editor
gorkana,"The Law Society Gazette, Web Content Editor", Web Content Editor
gorkana,"IFLScience, Video Editor", Video Editor
gorkana,"Imagine, Junior Designer", Junior Designer
gorkana,"Natural Health and Your Fitness, Content Writer", Content Writer
gorkana,"The Independent, Senior Trending Content Journalist", Senior Trending Content Journalist
gorkana,Video Production Assistant,Video Production Assistant
gorkana,"Times Higher Education, Sub-Editor", Sub-Editor
gorkana,Content Manager,Content Manager
gorkana,"KICCA, Rugby Writer", Rugby Writer
gorkana,"Press Association, News Producers", News Producers
gorkana,"ING, Multi-media Journalist", Multi-media Journalist
gorkana,"T3, Global Editor-in-Chief", Global Editor-in-Chief
gorkana,"Immediate Media, Art Editor - Women’s Portfolio, New Launch", Art Editor
gorkana,Editorial Compliance Executive,Editorial Compliance Executive
gorkana,"The Sunday Times, Fashion Assistant - Intern, Style", Fashion Assistant
gorkana,"Emerald Street & Mr Hyde, Sub-Editor", Sub-Editor
gorkana,"The Sunday Times, Beauty Assistant - Intern, Style", Beauty Assistant
gorkana,"The Press Association, News Producer", News Producer
gorkana,"Reuters Breakingviews, Germany Columnist", Germany Columnist
gorkana,"Express.co.uk, Group Social Media Editor", Group Social Media Editor
htfp,Trainee Multimedia Reporter,Trainee Multimedia Reporter
htfp,Reporter,Reporter
htfp,Agenda Writer - Health & Social Affairs,Agenda Writer
htfp,Trends & Advance Content Writer,Trends & Advance Content Writer
htfp,Reporter,Reporter
htfp,Trainee Reporter,Trainee Reporter
htfp,News Editor,News Editor
htfp,What's On Writer,What's On Writer
htfp,Multimedia Reporter,Multimedia Reporter
htfp,Reporter,Reporter
htfp,Digital Content Journalist,Digital Content Journalist
htfp,Chief Reporter,Chief Reporter
htfp,Multimedia Journalist (Trainee),Multimedia Journalist 
htfp,Reporter,Reporter
htfp,Multimedia Journalist,Multimedia Journalist
htfp,Sub Editor,Sub Editor
htfp,Trainee Reporter,Trainee Reporter
htfp,Trainee Reporters x 3,Trainee Reporters x 3
htfp,What's On Writer,What's On Writer
htfp,Deputy Editor,Deputy Editor
htfp,Trainee Reporter,Trainee Reporter
htfp,Trainee Reporter,Trainee Reporter
htfp,Trainee Reporter,Trainee Reporter
htfp,Deputy Features Editor/Senior Features Writer,Deputy Features Editor/Senior Features Writer
htfp,Content Manager (print),Content Manager 
htfp,Senior Reporter,Senior Reporter
htfp,Production Journalist,Production Journalist
htfp,Multimedia Reporter,Multimedia Reporter
htfp,Northern Editor,Northern Editor
htfp,Advance Content Writer - News,Advance Content Writer
htfp,Chief Reporter/Deputy Head of Content,Chief Reporter/Deputy Head of Content
htfp,News Editor (Homepages Editor),News Editor 
htfp,Feature Writer,Feature Writer
htfp,News Editor & Sub Editor,News Editor & Sub Editor
htfp,Multimedia Reporter,Multimedia Reporter
htfp,Business Editor and Journalists,Business Editor and Journalists
htfp,Online Editor,Online Editor
htfp,Digital Reporter,Digital Reporter
htfp,Chief Reporter,Chief Reporter
htfp,Reporter,Reporter
htfp,Senior Reporter,Senior Reporter
htfp,Video-led Digital Sports Writer,Video-led Digital Sports Writer
htfp,Trainee Reporter,Trainee Reporter
htfp,"Investigative Journalist, Health", Health
htfp,Photographer,Photographer
htfp,Media and Communications Manager,Media and Communications Manager
htfp,Trainee Reporter,Trainee Reporter
htfp,Print Journalist,Print Journalist
htfp,Business Editor,Business Editor
htfp,News Editor,News Editor
htfp,Political Editor,Political Editor
htfp,Night News Reporter,Night News Reporter
htfp,Trainee Reporters,Trainee Reporters
htfp,Trainee Journalist,Trainee Journalist
htfp,News Editor,News Editor
htfp,Crime Correspondent,Crime Correspondent
htfp,Desk Editor,Desk Editor
htfp,Senior Reporter,Senior Reporter
htfp,Editor-in-Chief,Editor-in-Chief
htfp,Editor-in-chief,Editor-in-chief
htfp,Communications and Media Officer,Communications and Media Officer
htfp,Reporter,Reporter
htfp,Content Editor,Content Editor
htfp,Senior Reporter,Senior Reporter
htfp,Senior Reporter,Senior Reporter
htfp,Editor - North,Editor
htfp,Photographer,Photographer
htfp,Digital Content and Audience Manager,Digital Content and Audience Manager
htfp,Media and Communications Assistant,Media and Communications Assistant
htfp,Trainee Reporter,Trainee Reporter
htfp,Trainee Reporter,Trainee Reporter
htfp,Trainee Reporter,Trainee Reporter
htfp,Syndication Editor,Syndication Editor
htfp,Trainee Multimedia Reporter,Trainee Multimedia Reporter
htfp,Content Manager (Print),Content Manager 
htfp,Internal Communications Manager,Internal Communications Manager
htfp,Chief Sub-Editor,Chief Sub-Editor
htfp,Investigations and Politics Reporter,Investigations and Politics Reporter
htfp,Assistant News Editor,Assistant News Editor
htfp,Trainee Reporter,Trainee Reporter
htfp,Multimedia Reporter,Multimedia Reporter
htfp,Deputy Group Editor/ Content Editor,Deputy Group Editor/ Content Editor
htfp,Communications and Media Officer,Communications and Media Officer
htfp,Trainee Reporter,Trainee Reporter
htfp,Photographer,Photographer
htfp,Trainee Digital Journalist,Trainee Digital Journalist
htfp,News Editor,News Editor
htfp,Reporter,Reporter
htfp,Reporter,Reporter
htfp,Senior Reporter,Senior Reporter
htfp,Reporters,Reporters
htfp,Digital Reporter/Producer,Digital Reporter/Producer
htfp,Assistant News Editor,Assistant News Editor
htfp,News Reporter,News Reporter
htfp,Press Officer,Press Officer
htfp,Digital Journalist,Digital Journalist
htfp,"Senior Reporters, Trainee and Junior Reporters", Trainee and Junior Reporters
htfp,Lecturer in Multimedia Journalism,Lecturer in Multimedia Journalism
htfp,Reporter,Reporter
htfp,Senior or Trainee Reporter,Senior or Trainee Reporter
htfp,Journalist Vacancies,Journalist Vacancies
htfp,Digital Journalist / Assistant Digital Editor,Digital Journalist / Assistant Digital Editor
