source,original,corrected
gorkana,"Thomson Reuters, EMEA Production Editor - Breakingviews", EMEA Production Editor
gorkana,"Farmers Weekly, Livestock Editor", Livestock Editor
gorkana,"Press Association, City Reporter", City Reporter
gorkana,"MailOnline, Showbusiness Reporter", Showbusiness Reporter
gorkana,"GamblingCompliance, Managing Editor", Managing Editor
gorkana,"How To Spend It, Picture Editor", Picture Editor
gorkana,"Conference & Incentive Travel, News Editor", News Editor
gorkana,"i2Media, Production Manager", Production Manager
gorkana,"Gorkana, UK Research Team Leader", UK Research Team Leader
gorkana,"Telegraph Media Group, Head of Digital Publishing", Head of Digital Publishing
gorkana,"Metro.co.uk, Head of Pictures", Head of Pictures
gorkana,"ICIS, Markets Reporter (Sutton)", Markets Reporter 
gorkana,"Ink, Creative Solutions Manager", Creative Solutions Manager
gorkana,"Asset Finance International, Freelance Researcher / Writer - Homeworking", Freelance Researcher / Writer
gorkana,"InfraNews, Renewables Correspondent", Renewables Correspondent
gorkana,"Reporter, Advertising Age - NY",Reporter
gorkana,"Business Reporter, Technology Online Editor / Social Media Editor", Technology Online Editor / Social Media Editor
gorkana,"SWNS, Editorial Assistant", Editorial Assistant
gorkana,"Interactive Investor, Financial Journalist", Financial Journalist
gorkana,"The Grocer, Drinks Editor / Reporter", Drinks Editor / Reporter
gorkana,"ICIS, Markets Reporter - Maternity Cover", Markets Reporter
gorkana,"UKIP Media & Events, Assistant Editor", Assistant Editor
gorkana,"Financial News, Features Editor", Features Editor
gorkana,"KMTV, Broadcast Journalists", Broadcast Journalists
gorkana,"World News Media, Sales Executive", Sales Executive
gorkana,"Fine Food Digest, Assistant Editor", Assistant Editor
gorkana,"Mirror Online, Assistant Celebrity & TV Editor", Assistant Celebrity & TV Editor
gorkana,"S&P Global Market Intelligence, Reporter - Top News", Reporter
gorkana,"Redactive Media Group, Senior Graphic Designer - Marketing, Maternity Cover", Senior Graphic Designer
gorkana,"Which?, Senior Researcher / Writer - Fraud / Scams / Data Privacy", Senior Researcher / Writer
gorkana,"Newsweek International, World News Editor - Digital", World News Editor
gorkana,"MoneySavingExpert.com, Copywriter - Credit Club", Copywriter
gorkana,"Which?, Digital Content Manager", Digital Content Manager
gorkana,"Future, Senior News Writer - B2B Technology", Senior News Writer
gorkana,"FT Confidential Research, Principal - Asean", Principal
gorkana,"Platts Nuclear Publications, Editor - French-speaking", Editor
gorkana,"Farmers Guardian, Freelance Sub-Editor / Page Designer", Freelance Sub-Editor / Page Designer
gorkana,"NBC News Digital, Newsletter Editor / News Reporter", Newsletter Editor / News Reporter
gorkana,"Chemical Markets Reporter, ICIS Americas - TX",Chemical Markets Reporter
gorkana,"Staff Writer - Teaching Tolerance, Southern Poverty Law Center - AL",Staff Writer
gorkana,"Lonely Planet, Freelance Project Editors - Illustrated Non-fiction", Freelance Project Editors
gorkana,"Telegraph Media Group, Senior Reporter", Senior Reporter
gorkana,"Investment Week, Journalist", Journalist
gorkana,"The Hemming Group, Reporter", Reporter
gorkana,"Haymarket Consumer Technology, Graduate / Staff Writer", Graduate / Staff Writer
gorkana,"The Manufacturer, Digital Journalist", Digital Journalist
gorkana,"Blackhair Magazine, Editorial Assistant - Part Time", Editorial Assistant
gorkana,"Acoustic, Editor", Editor
gorkana,"Future, Production Editors", Production Editors
gorkana,"Market News International, Chief EU Correspondent (Brussels or London)", Chief EU Correspondent 
gorkana,"Hearst Magazines UK, Art Editor - Lifestyle Hub", Art Editor - Lifestyle Hub
gorkana,"Best, Celebrity Editor", Celebrity Editor
gorkana,"3CC, Freelance Editorial Assistant", Freelance Editorial Assistant
gorkana,"William Reed, Digital Editor - New Launch Food Innovation Service", Digital Editor
gorkana,"William Reed, Data Journalist - Premium Global Information Service Launch", Data Journalist
gorkana,"Telegraph Media Group, Digital Producer", Digital Producer
gorkana,"Take a Break, Feature Writer", Feature Writer
gorkana,"Mirror Online, Celebrity Reporter", Celebrity Reporter
gorkana,"NS Tech, News Editor", News Editor
gorkana,"PaymentsCompliance, Reporter", Reporter
gorkana,"Egmont, Junior Designer - Toxic Magazine", Junior Designer
gorkana,"Junior Reporter, VCJ - CA",Junior Reporter
gorkana,"Greenpeace, Senior Investigative Journalist", Senior Investigative Journalist
gorkana,"Energy Intelligence, Senior Energy Reporter (Dubai)", Senior Energy Reporter 
gorkana,"TalkingRetail.com / Independent Retail News, Content Editor", Content Editor
gorkana,"Which?, (Senior) Researcher / Writer", 
gorkana,"Bauer, Art Director - Creative Solutions Advertorials", Art Director
gorkana,"Beamly, Video Producer", Video Producer
gorkana,Account Executive - Marketing,Account Executive
gorkana,"Show Media, Deputy Chief Copy Editor", Deputy Chief Copy Editor
gorkana,"Reporter - Commercial Real Estate, Crain - IL",Reporter
gorkana,Marketing Account Executive - Integrated Creative,Marketing Account Executive
gorkana,"The Sun, Writer - Fabulous Daily, 12 Month Maternity Cover", Writer
gorkana,"Brides, Chief Sub and Production Editor", Chief Sub and Production Editor
gorkana,"IFLScience, Health Writer", Health Writer
gorkana,"loveFOOD.com, Editor", Editor
gorkana,"Editorial Writer / Editor, The Columbus Dispatch - OH",Editorial Writer / Editor
gorkana,"Immediate Media, Recruitment Assistant - 12 Month Internship", Recruitment Assistant
gorkana,"Experienced News Sub-Editors, The South China Morning Post - Hong Kong",Experienced News Sub-Editors
gorkana,"Moneywise, Web Content Manager / Writer", Web Content Manager / Writer
gorkana,"How To Spend It, Commissioning Editor - Maternity Cover", Commissioning Editor
gorkana,"Technical SEO Associate, The Wall Street Journal - NY",Technical SEO Associate
gorkana,"Deputy Editor,  AccountingWEB - NY",Deputy Editor
gorkana,"Market Talk, Reporter - 6 Month FTC", Reporter
gorkana,"Beamly, Content Producer", Content Producer
gorkana,"Energy Intelligence, Energy Reporter (Dubai)", Energy Reporter 
gorkana,"Roche Communications, Staff Writer", Staff Writer
gorkana,"MailOnline, Health Editor", Health Editor
gorkana,"Green Rewards, Communications Co-ordinator", Communications Co-ordinator
gorkana,"MADE.COM, Content and Social Media Writer", Content and Social Media Writer
gorkana,"Insight Marketing and Communications, Freelance Writer", Freelance Writer
gorkana,"Investing Editor, U.S. News & World Report - DC", U.S. News & World Report
gorkana,"IFLScience, Editorial Assistant", Editorial Assistant
gorkana,"Bauer, Web Producer - Business-To-Business Motoring", Web Producer
gorkana,"Tempus, Deputy Editor", Deputy Editor
gorkana,"Law Business Research, Trainee News Reporter", Trainee News Reporter
gorkana,"Editor-in-Charge - Corporate Regulation and Enforcement, Reuters - DC",Editor-in-Charge
gorkana,Marketing Senior Account Executive - Integrated,Marketing Senior Account Executive
gorkana,"The Economist Group, Senior Editor - Technology", Senior Editor
gorkana,Advertising Manager/Publisher,Advertising Manager/Publisher
gorkana,"Cruise Trade News, Editor", Editor
gorkana,"Junior Audience Analyst Associate, The Wall Street Journal - NY",Junior Audience Analyst Associate
gorkana,"Digital Entertainment Brand, Freelance News Writer", Freelance News Writer
gorkana,Exciting Digital Project Manager - Agency,Exciting Digital Project Manager
gorkana,"Lonely Planet, Freelance Book Designers - Illustrated Non-fiction", Freelance Book Designers
gorkana,"MoneyLaundering.com, Reporter (Hong Kong)", Reporter 
gorkana,"Product Analyst - Audience, The Wall Street Journal  - NY",Product Analyst
gorkana,"Aceville Publications, Editorial Assistant - Craft Department", Editorial Assistant
gorkana,Event Account Executive,Event Account Executive
gorkana,"Construction Week Qatar, Editor", Editor
gorkana,"Reporter - Transportation, The Wall Street Journal - NY",Reporter
gorkana,"The Independent, Trending Content Journalist", Trending Content Journalist
gorkana,"ITP Promedia, Editorial Assistant / Business Journalist (London)", Editorial Assistant / Business Journalist 
gorkana,"Editor - North America Pictures, Reuters - NY",Editor
gorkana,"William Reed, Insight Editor - Premium Global Information Service Launch", Insight Editor
gorkana,"Health Club Management, Editor", Editor
gorkana,"NCTJ, Digital Marketing and Communications Executive", Digital Marketing and Communications Executive
gorkana,"Personal Finance Reporter, MarketWatch - NY",Personal Finance Reporter
gorkana,"Lonely Planet, Freelance Copy Editors", Freelance Copy Editors
gorkana,"British Heart Foundation, Editor - Healthcare Professionals",British Heart Foundationealthcare Professionals
gorkana,"Professional Engineering, Features Technology Editor", Features Technology Editor
gorkana,"Hearst, Features Writer - Digital", Features Writer
gorkana,"Thomson Reuters, Credit Market Reporter -  International Financing Review",Thomson ReutersInternational Financing Review
gorkana,"Shard Media Group, Content Writer", Content Writer
gorkana,"Editor-in-Charge - Financial Regulation and Enforcement, Reuters - DC",Editor-in-Charge
gorkana,"Egmont, Editorial Controller - Children's Magazines", Editorial Controller
gorkana,"Condé Nast Digital, Chief Digital Officer", Chief Digital Officer
gorkana,"CNN Style, Senior Digital Producer", Senior Digital Producer
gorkana,"Homes & Antiques, Editorial & Digital Assistant", Editorial & Digital Assistant
gorkana,"The Sun, SEO Editor", SEO Editor
gorkana,"News Recruitment Editor & Operations Administrator, The Wall Street Journal - NY",News Recruitment Editor & Operations Administrator
gorkana,"BusinessBecause, Intern - Graduate Journalism / Editorial Opportunity", Intern
gorkana,"The Handbook, Editorial Assistant Intern", Editorial Assistant Intern
gorkana,"The Sun, Digital Production Editor", Digital Production Editor
gorkana,"The Huffington Post, Commercial Editor", Commercial Editor
gorkana,"Drapers, Deputy Editor", Deputy Editor
gorkana,"KMTV, Senior Broadcast Journalist", Senior Broadcast Journalist
gorkana,"News Editor - Operations and Change Leadership, The Wall Street Journal - NY",News Editor
gorkana,"City A.M., Reporter", Reporter
gorkana,"Saga Publishing, Digital Editor - 9 Months Maternity Cover", Digital Editor
gorkana,"Investigative Reporter, The Oklahoman - OK",Investigative Reporter
gorkana,"Goal.com, International Managing Editor", International Managing Editor
gorkana,Senior Reporter,Senior Reporter
gorkana,"Reveal, Deputy Features Editor", Deputy Features Editor
gorkana,"Middle East Architect, Editor", Editor
gorkana,"By Terry, Digital & Social Media Co-Ordinator", Digital & Social Media Co-Ordinator
gorkana,"All About History, Editor", Editor
gorkana,"IFLScience, Social Media Assistant", Social Media Assistant
gorkana,"Thomson Reuters, M&A Correspondent", M&A Correspondent
gorkana,"Gorkana, Media Researcher / Executive", Media Researcher / Executive
gorkana,"Market News International, Chief ECB Correspondent (Frankfurt or London)", Chief ECB Correspondent 
gorkana,"GQ, Account & Social Media Manager", Account & Social Media Manager
gorkana,"Product Liability Reporter, Reuters (Level 1 Journalist) - NY", Reuters 
gorkana,"FT Confidential Research, Research Editor", Research Editor
gorkana,"The Sun, Features Writer - Part Time Maternity Cover", Features Writer
gorkana,Marketing Senior Account Manager - Creative,Marketing Senior Account Manager
gorkana,"Elle Decoration, Sub-Editor", Sub-Editor
gorkana,"Investigative Reporter,  Southern Poverty Law Center - AL",Investigative Reporter
gorkana,"SHOP Magazine, Fashion Editor - Maternity Cover", Fashion Editor
gorkana,"Bauer, Production Editor - Motorcycle Monthlies Hub", Production Editor
gorkana,"New Women’s Lifestyle Title, Digital Editor", Digital Editor
gorkana,"Social Media Editor, Reuters TV (Level 1 Journalist) - NY", Reuters TV 
gorkana,Digital Marketing Executive - Marketing Automation,Digital Marketing Executive
gorkana,"Dow Jones, Private Equity Reporter", Private Equity Reporter
gorkana,"Immediate Media, Sports Writer - Sports Technical Hub", Sports Writer
gorkana,"Egmont, Designer - Fiction Books", Designer
gorkana,"Progressive Content, Senior Sub-Editor", Senior Sub-Editor
gorkana,Marketing Account Manager - Integrated Creative,Marketing Account Manager
gorkana,"Thomson Reuters, Metals Correspondent (Beijing or Shanghai)", Metals Correspondent 
gorkana,"Luxemburger Wort, News Reporter", News Reporter
gorkana,"Beamly, Junior Beauty Writer", Junior Beauty Writer
gorkana,"N by Norwegian, Digital Editor", Digital Editor
gorkana,"Private Equity Africa, Junior Reporter", Junior Reporter
gorkana,"Legal Business, News Editor", News Editor
gorkana,"S&P Global Market Intelligence, Reporter - Consumer News", Reporter
gorkana,"IFLScience, Weekend Flexible Writer", Weekend Flexible Writer
gorkana,"RCNi, Copy Editor", Copy Editor
gorkana,"Tatler, Bookings Editor", Bookings Editor
gorkana,Managing Editor,Managing Editor
gorkana,"POLITICO, Brexit Reporter (Brussels)", Brexit Reporter 
gorkana,Junior Marketing Automation Technician,Junior Marketing Automation Technician
gorkana,"Senior Editor / Writer,  Southern Poverty Law Center - AL",Senior Editor / Writer
gorkana,"Mirror Online, Deputy Video Editor", Deputy Video Editor
gorkana,"Asthma UK, Health Content Editor", Health Content Editor
gorkana,Senior SEO Manager,Senior SEO Manager
gorkana,"Telegraph Media Group, Deputy Art Director - Stella Magazine", Deputy Art Director
gorkana,"hayu, Graphic Designer", Graphic Designer
gorkana,"CAR, Art Director", Art Director
gorkana,"Global Witness, Multimedia Manager", Multimedia Manager
gorkana,"Grand Designs Magazine, Editor", Editor
gorkana,"3CC, Freelance Editorial Designer", Freelance Editorial Designer
gorkana,Content Creator,Content Creator
gorkana,"South China Morning Post, Experienced News Sub-Editors (Hong Kong)", Experienced News Sub-Editors 
gorkana,"Alliance News, Reporters", Reporters
gorkana,"ING, Writer - International Consumer Economics", Writer
gorkana,"londoncyclist.co.uk, Freelance Writer", Freelance Writer
gorkana,"Personal Finance Content Writer, Student Loan Hero - Remote Working", Student Loan Hero
gorkana,"CNBC, Middle East Producer (UAE)", Middle East Producer 
gorkana,"Reveal, Fashion Writer", Fashion Writer
gorkana,"Senior Writer / Editor - Electronics, Consumer Reports - NY",Senior Writer / Editor
gorkana,"HELLO!, Video Coordinator", Video Coordinator
gorkana,"MoneyLaundering.com, Reporter", Reporter
gorkana,Reporter/Writer – Debt Market Commentary – London,Reporter/Writer – Debt Market Commentary – London
gorkana,"Evening Standard & Homes and Property (ESHP), Head of Audience Growth", Head of Audience Growth
gorkana,"football.london, Editor-in-Chief", Editor-in-Chief
gorkana,"Editorial Page Writer, The Wall Street Journal - NY",Editorial Page Writer
gorkana,"ICIS, Market Reporter", Market Reporter
gorkana,"Newsweek, London Bureau Chief", London Bureau Chief
gorkana,"BigHospitality and Restaurant Magazine, Reporter", Reporter
gorkana,"Proofreader / Copy Editor, CFRA - MD",Proofreader / Copy Editor
gorkana,"Contributing Editor, Tax Notes International - VA",Contributing Editor
gorkana,"Buying Business Travel, Online Editor", Online Editor
gorkana,"hitched.co.uk, Assistant Editor", Assistant Editor
gorkana,"Daily Mirror, Feature Writer", Feature Writer
gorkana,"TTG Media Limited, Marketing Manager", Marketing Manager
gorkana,"IQPC, Technology Editor", Technology Editor
gorkana,"Cybersecurity / Defense Tech Reporter, FCW - DC",Cybersecurity / Defense Tech Reporter
gorkana,"RT, Newsroom Journalist", Newsroom Journalist
gorkana,"Immediate Media, Charting Assistant", Charting Assistant
gorkana,"Family, Junior Designer", Junior Designer
gorkana,"Cover Images, Real Life Features Writer", Real Life Features Writer
gorkana,"Stuff, Staff Writer", Staff Writer
gorkana,"DJ Murphy, Junior Designer", Junior Designer
gorkana,"Runner's World, Section Editor", Section Editor
gorkana,"Asia - Oil Reporters, MT Newswires - Telecommute", MT Newswires
gorkana,"Evening Standard & Homes and Property (ESHP), Video Executive Producer", Video Executive Producer
gorkana,"GQ, Deputy Chief Sub-Editor", Deputy Chief Sub-Editor
gorkana,"TelecomFinance, Junior Financial Reporter", Junior Financial Reporter
gorkana,"Property Week, Associate Editor (Features) / Deputy Editor", Associate Editor 
gorkana,"Time Out, Global Film Editor", Global Film Editor
gorkana,"Legalease, Head of Asia Content", Head of Asia Content
gorkana,"World Travel Guide, Deputy Editor", Deputy Editor
gorkana,"RN, Reporter", Reporter
gorkana,"Daily Mirror, Night News Reporter", Night News Reporter
gorkana,"SHOP Magazine, Artworking Assistant", Artworking Assistant
gorkana,News Reporters,News Reporters
gorkana,"The Cricketer, Art Director", Art Director
gorkana,"Writer / Editor - Automobiles, Consumer Reports - CT",Writer / Editor
gorkana,"Senior Writer / Editor - Money, Consumer Reports - NY",Senior Writer / Editor
gorkana,"Real Deals, Reporter", Reporter
gorkana,"DFNI, Digital Editor - International Travel", Digital Editor
gorkana,"Vogue.co.uk, Engagement Manager", Engagement Manager
gorkana,"Cision, Media Research Intern - French Fluent", Media Research Intern
gorkana,Content Executive,Content Executive
gorkana,"Archant, Print Journalist (Norwich)", Print Journalist 
gorkana,"Insurance Times, Junior Reporter", Junior Reporter
gorkana,"Aceville Publications, Editorial Assistant - Special Projects Department", Editorial Assistant
gorkana,"MailOnline, Freelance Picture Researchers", Freelance Picture Researchers
gorkana,"Data Journalist, Activist Insight - NY",Data Journalist
gorkana,"TES Editorial, Assistant Commissioning Editor - Maternity Cover", Assistant Commissioning Editor
gorkana,"Boundless Magazine, Editor", Editor
gorkana,"The River Group, Food Editor - Monthly Food Magazine", Food Editor
gorkana,"The River Group, Editor / Managing Editor - Monthly Food Magazine", Editor / Managing Editor
gorkana,Professional Research Writer,Professional Research Writer
gorkana,"Institute of Art and Ideas, Digital Content Trainee", Digital Content Trainee
gorkana,Reporter,Reporter
gorkana,"HITC, Freelance Football Writers", Freelance Football Writers
gorkana,"Grazia, Art Intern - Digital Content Co-ordinator & Designer", Art Intern
gorkana,"Reuters Video News, Senior Producer", Senior Producer
gorkana,"Senior Photographer, Reuters (Level 1 Journalist) - DC", Reuters 
gorkana,"Big Little Media, Deputy Editor / Editor", Deputy Editor / Editor
gorkana,"SHOP Magazine, Production Editor", Production Editor
gorkana,"TEISS, Technology Online Editor / Social Media Editor", Technology Online Editor / Social Media Editor
gorkana,"The Times, Sub-Editor - Sport", Sub-Editor
gorkana,"Vogue International, Motions Graphic Designer", Motions Graphic Designer
gorkana,"Immediate Media, Deputy Art Editor", Deputy Art Editor
gorkana,"YOU Magazine, Fashion Intern", Fashion Intern
gorkana,Editor (Singapore),Editor 
gorkana,"Gorkana, International Media Researcher - Czech-speaking", International Media Researcher
gorkana,"Funds and M&A Reporter - Americas, InfraLatinAmerica & InfraAmericas - NY", InfraLatinAmerica & InfraAmericas
gorkana,"Deezeen, Editorial Assistant", Editorial Assistant
gorkana,"BIRN, Regional Network Director (Balkans)", Regional Network Director 
gorkana,"Kitchens Bedrooms & Bathrooms, Features Writer", Features Writer
gorkana,"Harper’s Bazaar and Town & Country, Executive Fashion & Jewellery Editor", Executive Fashion & Jewellery Editor
gorkana,"Hart Square, Editor / Content Producer - Not-for-Profit Website / Newsletters", Editor / Content Producer
gorkana,"Ink, Creative Solutions Writer", Creative Solutions Writer
gorkana,"Mawsonia Publications, Sub-Editor", Sub-Editor
gorkana,"The Times & The Sunday Times, Head of Print Sales and Subscriptions", Head of Print Sales and Subscriptions
gorkana,"National Geographic Kids Magazine, Graphic Designer", Graphic Designer
gorkana,"Barcroft Media, Junior Content Licensing Executive", Junior Content Licensing Executive
gorkana,"Digital Editor, WSJ Opinion Section - NY",Digital Editor
gorkana,"Editor - Features, Special Content & Live Journalism, The Wall Street Journal - NY", Special Content & Live Journalism
gorkana,"TheBusinessDesk.com, Business Editor (Yorkshire)", Business Editor 
gorkana,"The Sunday Times, Designer - Style", Designer
gorkana,"Mollie Makes, Commissioning Editor", Commissioning Editor
gorkana,"MailOnline, Freelance Moderators", Freelance Moderators
gorkana,"ComplianceOnline, Sub-Editor", Sub-Editor
gorkana,"MailOnline, Sub-Editor - French", Sub-Editor
gorkana,"Editorial Director, Orb Media - DC",Editorial Director
gorkana,Science/Medical Journalist,Science/Medical Journalist
gorkana,Research Editor / Writer,Research Editor / Writer
gorkana,"T3, Staff Writer - Products & Style", Staff Writer
gorkana,"FC Business Intelligence, Staff Writer / Assistant Editor", Staff Writer / Assistant Editor
gorkana,"The Big Issue, Art Director", Art Director
gorkana,"Channelnomics Europe, Reporter", Reporter
gorkana,"The Times & The Sunday Times, Head of Digital Subscriptions - Marketing and Sales", Head of Digital Subscriptions
gorkana,"The Times, Designer - Features and News", Designer
gorkana,"Kitchens Bedrooms & Bathrooms, Sub-Editor", Sub-Editor
gorkana,"Think, Designer", Designer
gorkana,"Reporter - White House, The Wall Street Journal - DC",Reporter
gorkana,"BPG Media, Graphic Designer", Graphic Designer
gorkana,"The Sunday Times, Art Director - Style", Art Director
gorkana,"Mirror Online, Senior Reporter - Celebrity & TV", Senior Reporter
gorkana,"Mawsonia Publications, Reporter", Reporter
gorkana,"Thomson Reuters, Chief UK / European Correspondent - Financial Regulation and Compliance", Chief UK / European Correspondent
gorkana,"You & Your Wedding, Lifestyle Editor - Maternity Cover", Lifestyle Editor
gorkana,"Education Editor, POLITICO Pro - VA",Education Editor
gorkana,"TheWeek.co.uk, Freelance Video Producers", Freelance Video Producers
gorkana,"Infrastructure Investor, Senior Reporter", Senior Reporter
gorkana,"Reporter, LevFin Insights - NY",Reporter
gorkana,"Harper’s Bazaar Arabia, Editorial Producer", Editorial Producer
gorkana,"The Sun, Digital Production Editor", Digital Production Editor
gorkana,"Where London & London Planner, Associate Editor", Associate Editor
gorkana,"The Welwyn Hatfield Times, Trainee Reporter", Trainee Reporter
gorkana,"Editor - Strategic Initiatives, The Wall Street Journal - NY",Editor
gorkana,"airberlin, German Editor", German Editor
gorkana,"Asset-Backed Alert, Reporter - NJ",Asset-Backed Alert
gorkana,"The Sun, Picture Editor - Fabulous, 12 Month Maternity Cover", Picture Editor
gorkana,"Reuters.com, Digital Producer", Digital Producer
gorkana,"E&T, Digital Content Editor", Digital Content Editor
gorkana,"Which?, Digital Writer - Home",Which?me
gorkana,"Telegraph Media Group, Senior Content Editor - Travel", Senior Content Editor
gorkana,"New Women’s Lifestyle Title, Editorial & Digital Assistant - Immediate Start", Editorial & Digital Assistant
gorkana,"The Sunday Times, Features Editor - Style", Features Editor
gorkana,"The Sun, Features Writer - Fabulous", Features Writer
gorkana,"Technology Correspondent, Reuters (Level 1 Journalist) - CA", Reuters 
gorkana,"Farmers Weekly, Community Editor", Community Editor
gorkana,"IPE Real Estate, News Editor", News Editor
gorkana,Daily US Economic and Market Commentary – New York or London,Daily US Economic and Market Commentary – New York or London
gorkana,"Newsweek Media Group, Video News Producer", Video News Producer
gorkana,"Telegraph Media Group, Commissioning Editor / Writer - Culture", Commissioning Editor / Writer
gorkana,"FreelanceJournalist.co.uk, Journalist", Journalist
gorkana,"Share Radio, Audio Editor / Studio Engineer", Audio Editor / Studio Engineer
gorkana,"Money Management, Junior Reporter / Editorial Assistant", Junior Reporter / Editorial Assistant
gorkana,"Reporter - Refined Products, Argus - CA",Reporter
gorkana,"PrintWeek, News Editor", News Editor
gorkana,"Mawsonia Publications, Features Editor - GCV",Mawsonia PublicationsV
gorkana,Reporter – Investments – London,Reporter – Investments – London
gorkana,"New Women’s Lifestyle Title, Digital Editor - Immediate Start", Digital Editor
gorkana,Awards Sponsorship Sales Manager,Awards Sponsorship Sales Manager
gorkana,"Hedge Fund Alert, Business Reporter - NJ",Hedge Fund Alert
gorkana,"DFNI, Editor", Editor
gorkana,"The Jewish Chronicle, Foreign Editor", Foreign Editor
gorkana,"Dezeen, Reporter", Reporter
gorkana,"Oil Reporters, MT Newswires - Telecommute", MT Newswires
gorkana,"Health Care Reporter, POLITICO Pro - VA",Health Care Reporter
gorkana,"Horizon, Deputy Editor (Brussels)", Deputy Editor 
gorkana,"MailOnline, Community Moderator", Community Moderator
gorkana,"Editorial Producer, Harper’s Bazaar Arabia - Dubai", Harper’s Bazaar Arabia
gorkana,"TES Editorial, Sub-Editor - Maternity Cover", Sub-Editor
gorkana,"Community Care, Associate Editor", Associate Editor
gorkana,"Hearst, Bookings Assistant", Bookings Assistant
gorkana,"Sleek Magazine, Digital Editor (Berlin)", Digital Editor 
gorkana,"HELLO! Magazine, Beauty Editor", Beauty Editor
